{
    "$schema": "https://raw.githubusercontent.com/gruncellka/porto-data/refs/heads/main/schemas/restrictions.schema.json",
    "file_type": "restrictions",
    "unit": {
        "country_code": "ISO 3166-1 alpha-2",
        "date": "ISO 8601"
    },
    "sanctions_information": {
        "eu_sanctions": {
            "description": "Germany/Deutsche Post complies with EU sanctions",
            "primary_targets": [
                "Russia (comprehensive sanctions)",
                "Belarus (comprehensive sanctions)",
                "Iran (nuclear-related sanctions)",
                "North Korea (comprehensive sanctions)",
                "Syria (comprehensive sanctions)"
            ],
            "source": "EU Common Foreign and Security Policy",
            "url": "https://www.sanctionsmap.eu/"
        },
        "un_sanctions": {
            "description": "Deutsche Post complies with UN Security Council sanctions",
            "targets": [
                "North Korea",
                "Iran",
                "Taliban (Afghanistan)",
                "Various terrorist organizations"
            ]
        },
        "german_national": {
            "description": "Germany may have additional national restrictions",
            "notes": "May be stricter than EU requirements in some cases"
        }
    },
    "denied_party_screening": {
        "description": "Deutsche Post conducts Denied Party Screening",
        "details": "Shipments are screened against international sanctions lists to prevent transactions with prohibited individuals, entities, or destinations",
        "compliance": [
            "EU sanctions lists",
            "UN sanctions lists",
            "German national restrictions",
            "OFAC (US sanctions)",
            "Other international embargo lists"
        ]
    },
    "sources": [
        "EU Sanctions Map",
        "Deutsche Post Denied Party Screening policy",
        "USPS International Mail Manual (reference)",
        "Norway Posten country restrictions (reference)",
        "Public information on international sanctions"
    ],
    "disclaimer": "This information is for reference only. Restrictions change frequently. Always verify current restrictions with Deutsche Post before shipping. | Volatility: This list can change rapidly due to political developments, conflicts, or natural disasters | Verification: Always verify current restrictions with Deutsche Post before sending | Customs: Even if postal service is available, customs duties and restrictions may apply | Payment: Payment services (Nachnahme, insurance) may not be available even if basic postal service exists | Recommendation: For business/important shipments, consult Deutsche Post customer service for current status",
    "restrictions": [
        {
            "id": "CRIMEA_2014",
            "country_code": "UA",
            "region_code": "UA-43",
            "claimed_by": "UA",
            "occupied_by": "RU",
            "status": "prohibited",
            "reason": "Illegal annexation, EU sanctions",
            "restrictions": "No postal services from EU/Germany",
            "notes": "Annexed by Russia 2014, not recognized by international community",
            "entity_type": "occupied_territory",
            "framework_id": "EU_SANCTIONS_OCCUPIED_UA",
            "effective_from": "2014-03-18",
            "effective_to": null,
            "effective_partial": false
        },
        {
            "id": "DONETSK_2014",
            "country_code": "UA",
            "region_code": "UA-14",
            "claimed_by": "UA",
            "occupied_by": "RU",
            "status": "prohibited",
            "reason": "Occupation, EU sanctions",
            "restrictions": "No postal services",
            "notes": "Occupied territories in eastern Ukraine",
            "entity_type": "occupied_territory",
            "framework_id": "EU_SANCTIONS_OCCUPIED_UA",
            "effective_from": "2014-04-07",
            "effective_to": null,
            "effective_partial": true
        },
        {
            "id": "KHERSON_2022",
            "country_code": "UA",
            "region_code": "UA-65",
            "claimed_by": "UA",
            "occupied_by": "RU",
            "status": "prohibited",
            "reason": "Partial occupation, EU sanctions",
            "restrictions": "No postal services to occupied areas",
            "notes": "Southern Ukraine, partially occupied since 2022. City of Kherson liberated Nov 2022, but parts remain occupied",
            "entity_type": "occupied_territory",
            "framework_id": "EU_SANCTIONS_OCCUPIED_UA",
            "effective_from": "2022-02-24",
            "effective_to": null,
            "effective_partial": true
        },
        {
            "id": "KP_SANCTIONS",
            "country_code": "KP",
            "status": "prohibited",
            "reason": "International sanctions, political situation",
            "restrictions": "All merchandise prohibited. Only letters and postcards may be allowed with severe restrictions.",
            "notes": "One of the most restricted destinations globally",
            "entity_type": "country",
            "framework_id": "UN_SC_RES_1718",
            "zone_reference": null,
            "effective_from": "2006-10-09",
            "effective_to": null
        },
        {
            "id": "LUHANSK_2014",
            "country_code": "UA",
            "region_code": "UA-09",
            "claimed_by": "UA",
            "occupied_by": "RU",
            "status": "prohibited",
            "reason": "Occupation, EU sanctions",
            "restrictions": "No postal services",
            "notes": "Occupied territories in eastern Ukraine",
            "entity_type": "occupied_territory",
            "framework_id": "EU_SANCTIONS_OCCUPIED_UA",
            "effective_from": "2014-04-27",
            "effective_to": null,
            "effective_partial": true
        },
        {
            "id": "SY_SANCTIONS",
            "country_code": "SY",
            "status": "prohibited",
            "reason": "Ongoing conflict, EU sanctions",
            "restrictions": "Most postal services suspended",
            "notes": "Civil war and international sanctions",
            "entity_type": "country",
            "framework_id": "EU_36_2012",
            "zone_reference": null,
            "effective_from": "2011-05-09",
            "effective_to": null
        },
        {
            "id": "YE_CONFLICT",
            "country_code": "YE",
            "status": "prohibited",
            "reason": "Ongoing conflict, operational challenges",
            "restrictions": "Postal services severely limited or suspended",
            "notes": "Humanitarian crisis and armed conflict",
            "entity_type": "country",
            "framework_id": "CONFLICT_YE",
            "zone_reference": null,
            "effective_from": "2015-03-26",
            "effective_to": null
        },
        {
            "id": "ZAPORIZHZHIA_2022",
            "country_code": "UA",
            "region_code": "UA-23",
            "claimed_by": "UA",
            "occupied_by": "RU",
            "status": "prohibited",
            "reason": "Partial occupation, EU sanctions",
            "restrictions": "No postal services to occupied areas",
            "notes": "Southern Ukraine, partially occupied since 2022",
            "entity_type": "occupied_territory",
            "framework_id": "EU_SANCTIONS_OCCUPIED_UA",
            "effective_from": "2022-02-24",
            "effective_to": null,
            "effective_partial": true
        },
        {
            "id": "AF_2021_TALIBAN",
            "country_code": "AF",
            "status": "severely_restricted",
            "reason": "Political situation, operational challenges",
            "restrictions": "Postal services severely limited or suspended",
            "notes": "Service disruptions since Taliban takeover 2021",
            "effective_from": "2021-08-15",
            "effective_to": null,
            "zone_reference": "zone_4_asia",
            "entity_type": "country",
            "framework_id": "CONFLICT_AF"
        },
        {
            "id": "BY_2022_SANCTIONS",
            "country_code": "BY",
            "status": "severely_restricted",
            "reason": "EU sanctions, support for Russian invasion",
            "restrictions": "Parcel services suspended. Limited letter services.",
            "notes": "Sanctions due to cooperation with Russia",
            "effective_from": "2022-03-01",
            "effective_to": null,
            "zone_reference": "zone_2_europe",
            "entity_type": "country",
            "framework_id": "EU_833_2014"
        },
        {
            "id": "IR_SANCTIONS",
            "country_code": "IR",
            "status": "severely_restricted",
            "reason": "International sanctions, nuclear program",
            "restrictions": "Severe limitations on all postal services. Payment restrictions.",
            "notes": "Long-standing sanctions",
            "effective_from": "2006-07-31",
            "effective_to": null,
            "zone_reference": null,
            "entity_type": "country",
            "framework_id": "UN_SC_RES_2231"
        },
        {
            "id": "LY_CONFLICT",
            "country_code": "LY",
            "status": "severely_restricted",
            "reason": "Civil conflict, instability",
            "restrictions": "Parcel services suspended. Letter services limited.",
            "notes": "Ongoing civil conflict",
            "effective_from": "2011-02-17",
            "effective_to": null,
            "zone_reference": "zone_3_africa_middle_east",
            "entity_type": "country",
            "framework_id": "CONFLICT_LY"
        },
        {
            "id": "RU_2022_SANCTIONS",
            "country_code": "RU",
            "status": "severely_restricted",